{
  "assistant_response": {
    "model_identity": "fixture-schema-validator",
    "raw_content": "{\"contract_version\":\"growth.live_video_review_response.v1\",\"coverage\":[{\"attachment_label\":\"A\",\"every_frame_inspected\":false,\"inspected_ranges\":[{\"end_ms\":5000,\"kind\":\"sampled_review\",\"start_ms\":0}],\"notes\":\"Fixture coverage used only to validate parser behavior.\",\"uninspected_possible\":true},{\"attachment_label\":\"B\",\"every_frame_inspected\":false,\"inspected_ranges\":[{\"end_ms\":5000,\"kind\":\"sampled_review\",\"start_ms\":0}],\"notes\":\"Fixture coverage used only to validate parser behavior.\",\"uninspected_possible\":true}],\"observations\":[{\"attachment_label\":\"A\",\"confidence\":0.72,\"defect_category\":\"hook_clarity\",\"description\":\"Fixture-only hook defect.\",\"end_ms\":1800,\"evidence\":\"Fixture observation for strict parser coverage only.\",\"proposed_edit\":\"Tighten the opening and improve on-screen hook text.\",\"severity\":\"major\",\"start_ms\":900,\"uncertainty\":\"Fixture data; not a genuine attached-video review.\"},{\"attachment_label\":\"B\",\"confidence\":0.66,\"defect_category\":\"audio_voice_music_balance\",\"description\":\"Fixture-only mix defect.\",\"end_ms\":3200,\"evidence\":\"Fixture observation for strict parser coverage only.\",\"proposed_edit\":\"Duck the background music under speech.\",\"severity\":\"minor\",\"start_ms\":2100,\"uncertainty\":\"Fixture data; not a genuine attached-video review.\"}],\"pairwise\":{\"confidence\":0.6,\"rationale\":\"Fixture-only pairwise value used to validate parsing.\",\"selection\":\"A\",\"uncertainty\":\"Not a real model judgment.\"},\"summaries\":[{\"assessment\":\"actionable_findings\",\"attachment_label\":\"A\",\"confidence\":0.7,\"summary\":\"Fixture summary A.\",\"uncertainty\":\"Fixture only.\"},{\"assessment\":\"actionable_findings\",\"attachment_label\":\"B\",\"confidence\":0.65,\"summary\":\"Fixture summary B.\",\"uncertainty\":\"Fixture only.\"}]}",
    "raw_sha256": "f9201d5b066f85d3089e685697e04c3636d726026c3b4372d5ce6349cbd924cc"
  },
  "capture_digest": "b7af2d9c73595bbabd5c8e76fc773020bed9442a28fb352aab7aba2e72cf6cc7",
  "capture_id": "glvrc1:ccce1eb76561d19719c49e49d99f2cfef48e04713452a70dfab146780b84c30b",
  "capture_kind": "fixture",
  "contract_version": "growth.live_video_review_capture.v1",
  "conversation": {
    "assistant_message_id": "fixture-assistant-message-r24",
    "conversation_id": "fixture-conversation-r24",
    "review_request_id": "fixture-review-request-r24"
  },
  "evidence_boundary": {
    "human_ground_truth": false,
    "human_label": false,
    "human_parity_gate_eligible": false,
    "live_platform_evidence": false
  },
  "request_binding": {
    "attachments": [
      {
        "attachment_sha256": "3bd12d999264cb932cb3ef15dfbd96e002ede517f2273795b593553b9642d864",
        "attachment_size": 575465,
        "blind_label": "A",
        "candidate_id": "candidate-1",
        "generic_file_name": "review-A.mp4",
        "mime_type": "video/mp4",
        "render_export_sha256": "2b5177c00bb054184a239c7eddb1383ad253922e8eb686f5aa2e56c91a1335ac",
        "render_sha256": "3bd12d999264cb932cb3ef15dfbd96e002ede517f2273795b593553b9642d864",
        "render_size": 575465
      },
      {
        "attachment_sha256": "cdae63d5ccce67332e607af7fd87b18c31da8dc77c2f0ce5182550321767286c",
        "attachment_size": 576763,
        "blind_label": "B",
        "candidate_id": "candidate-2",
        "generic_file_name": "review-B.mp4",
        "mime_type": "video/mp4",
        "render_export_sha256": "b349b897f8f86bc9257e2622f564d6430f3864ff605ae4b82ba0cb09c59298f6",
        "render_sha256": "cdae63d5ccce67332e607af7fd87b18c31da8dc77c2f0ce5182550321767286c",
        "render_size": 576763
      }
    ],
    "bridge_r26": {
      "attachment_contract": "bridge.chat_file_attachment.v1",
      "repository": "foto6/WebAIBridge",
      "source_sha": "73c13f9eed2a2cbcea881dd8c5452d054bfef940"
    },
    "media": {
      "producer_sha": "231a0680c8939cfec77aaa283e507e93f383ad73",
      "repository": "foto6/video2"
    },
    "media_r18": {
      "artifact_digest": "sha256:1f2ac715ec787be14564201445737f19825f56267a7cab6fb99553aaaff013eb",
      "artifact_id": 11210373001,
      "artifact_name": "media-r18-direct-model-review",
      "ci_run_id": 36967381891,
      "package_digest": "c7af4d86acddb2b1bc67135449610386188fead05e0801dbb32e8857afe4945d",
      "package_file_sha256": "23b36200e0023913f5435b99748f3ded92cb9ed86a9f769d7d64bb0d6743771e",
      "repository": "foto6/video2",
      "source_sha": "2c41f084e000eca5efd9a51d2d3752bec1bd1311"
    },
    "prompt": {
      "contract_version": "media.direct_model_review_prompt.v1",
      "prompt_text_sha256": "2f79d24571f0e9d0fb051702678125d6b50308323aab0923b154ee7e16b3c9d2",
      "sha256": "98e377f73f26d9960acc34703797f962ef75472597acdbefc6dfdc82636b06b6"
    },
    "review_bundle": {
      "contract_version": "growth.real_artifact_decision_pack.v1",
      "digest": "d415659c4a24dfd4198c6d08bb0fecf524086b0c2031d68395b739bf0dd631d3"
    },
    "source": {
      "sha256": "7b484abef5de1569e1b7f91a5d780f17c6d687ef68b3c42c9e54375f4e5e434b",
      "size": 763377,
      "source_id": "r16-demo-source"
    }
  }
}
